title,text,date
КЖД раскрыла подробности пожара на Крымском мосту,"Возгорание топливной цистерны в хвосте грузового поезда произошло на Крымском мосту в субботу, 8 октября. О деталях рассказали ТАСС в пресс-службе Крымской железной дороги (КЖД).В организации добавили, что локомотив с частью вагонов выведен на станцию Керчь, ведутся аварийные работы, устанавливаются причины происшествия.Подробности пожара также раскрыл советник главы Крыма Олег Крючков в своем Telegram-канале. По его словам, цистерна с топливом, по предварительным данным, загорелась на одном из участков моста.Уточняется, что один из вагонов товарного поезда, который шел из Тамани в Керчь, загорелся в районе 6:00 утра. О причинах возгорания и пострадавших не сообщалось.По информации советника Крыма, паромная переправа на фоне ЧП на Крымском мосту находится в готовности к запуску, полуостров обеспечен запасом горючего и продовольствия.Ранее пресс-службу дорожного управления «Тамань» сообщила, что движение автомобилей и поездов по Крымскому мосту приостановлено. «Движение на транспортном переходе через Керченский пролив временно приостановлено», — сообщили в ведомстве.Уточняется, что на подъездах к мосту для водителей разворачиваются пункты питания и обогрева, все службы работают слаженно.Власти Крыма призвали россиян пользоваться только официальной информацией во избежание распространения «вражеских фейков и вбросов».",2022-10-08 00:00:00
В Крыму заявили об отсутствии пострадавших при пожаре на мосту,"По предварительным данным, пострадавших при возгорании топливной цистерны на Крымском мосту нет. Об отсутствии раненых заявил советник главы Крыма Олег Крючков, передает ТАСС.«Предварительно, пострадавших нет», — заявил он.",2022-10-08 00:00:00
Паромную переправу из-за пожара на Крымском мосту приготовили к запуску,"Паромная переправа из-за пожара на Крымском мосту готова к запуску. Об этом сообщил советник главы республики по информационной политике Олег Крючков в своем Telegram-канале.«Крым обеспечен запасом горючего и продовольствия. Паромная переправа находится в готовности к запуску», — написал Крючков в своем Telegram-канале. По его словам, на полуострове отработаны все логистические схемы на случай ЧС.Утром 8 октября произошел пожар на Крымском мосту. Как заявил Олег Крючков, на одном из участков сооружения, по предварительным данным, загорелась цистерна с топливом, судоходные арки не повреждены. Движение по Крымскому мосту приостановлено.",2022-10-08 00:00:00
Названы альтернативы сообщения с Россией после пожара на Крымском мосту,"В Крыму прорабатываются вопросы запуска паромной переправы в Керчи, а также альтернативные пути сообщения полуострова с материковой Россией после приостановки движения на Крымском мосту из-за пожара. Их в разговоре с РИА Новости назвал глава Минтранса республики Николай Лукашенко.«В настоящее время данная работа (запуск паромов) ведется, да», — заявил Лукашенко. По его словам, также прорабатываются все возможные альтернативные варианты сообщения с Крымом.Ранее в пресс-службе Крымской железной дороги (КЖД) сообщили, что возгорание топливной цистерны произошло в хвосте грузового поезда на Крымском мосту. Локомотив с частью вагонов выведен на станцию Керчь, ведутся аварийные работы, устанавливаются причины происшествия.Пожар на Крымском мосту произошел утром в субботу, 8 октября. Как рассказал советник главы Крыма Олег Крючков, на одном из участков сооружения, по предварительным данным, загорелась цистерна с топливом, судоходные арки не повреждены. Движение по Крымскому мосту приостановлено.В пресс-службе Крымской железной дороги (КЖД) сообщили, что возгорание топливной цистерны произошло в хвосте грузового поезда на Крымском мосту. Локомотив с частью вагонов выведен на станцию Керчь, ведутся аварийные работы, устанавливаются причины происшествия. Очевидцы опубликовали кадры обстановки на мосту.Ранее советник главы офиса президента Украины Владимира Зеленского Михаил Подоляк заявил  о намерении Киева разрушить Крымский мост. Подоляк назвал мост законной военной целью. Однако, каким именно образом Вооруженные силы Украины (ВСУ) могут нанести удар, чиновник не уточнил.",2022-10-08 00:00:00
Опубликовано видео обстановки на Крымском мосту,"Telegram-канал Mash опубликовал видео очевидцев обстановки на Крымском мосту, где утром в субботу, 8 октября, произошло возгорание топливной цистерны в хвосте грузового поезда.На кадрах видно, что пламя охватило несколько вагонов товарного поезда. Также повреждено дорожное полотно.Ранее в пресс-службе Крымской железной дороги (КЖД) сообщили, что возгорание топливной цистерны произошло в хвосте грузового поезда на Крымском мосту. Локомотив с частью вагонов выведен на станцию Керчь, ведутся аварийные работы, устанавливаются причины происшествия.Пожар на Крымском мосту произошел утром в субботу, 8 октября. Как рассказал советник главы Крыма Олег Крючков, на одном из участков сооружения, по предварительным данным, загорелась цистерна с топливом, судоходные арки не повреждены. Движение по Крымскому мосту приостановлено.",2022-10-08 00:00:00
В Японии высказались об участии в «Сахалине-1»,"В настоящее время Япония приостановила импорт нефти с проекта «Сахалин-1», однако считает участие в проекте, в котором японская Sodeco имеет 30 процентов, важным с точки зрения энергетической безопасности. Об этом заявил представитель Минэка Японии, сообщает ТАСС.«[Проект] является важным источником [нефти] за пределами Ближнего Востока. Нет изменений в [позиции о] важности интересов (участия в качестве акционеров) в ""Сахалине-1"" с точки зрения энергетической безопасности страны», — передает агентство.По информации ведомства, ранее сократившая до минимума закупки российской нефти Япония, в настоящее время не импортирует нефть с «Сахалина-1».7 октября президент России Владимир Путин подписал указ о создании нового оператора проекта «Сахалин-1». Новым управляющим оператором «Сахалина-1» станет «дочка» «Роснефти» «Сахалинморнефтегаз-Шельф», она получит в новом операторе 11,5 процента, еще 8,5 процента перейдут к другой дочке «Роснефти» — «РИ-Астра».",2022-10-08 00:00:00
США призвали отказаться от поддержки Украины,"Аналитик Джош Хаммер призвал США отказаться от поддержки Украины. Об этом он написал в своей статье для The Epoch Times.По его словам, американская сторона должна как можно быстрее изменить свою стратегию на Украине. Аналитик считает, что обещания президента США Джо Байдена продолжать поддерживать Киев на данном этапе пусты и бесполезны.Эксперт отметил, что стороны подошли к той точке, когда национальные интересы Соединенных Штатов в отношении Киева не совпадают с позицией украинского лидера Владимира Зеленского. Аналитик подчеркнул, что президент Украины заинтересован в продолжении эскалации и этот подход опасен для Вашингтона.По словам Хаммера, изначально было понятно, что Украина является глубоко коррумпированной страной, однако США все равно оказывают поддержку стране. Аналитик считает, что американские власти рискуют разозлить своих граждан, если продолжат настаивать на своем.Ранее Reuters опубликовало данные опроса, согласно которому трое из четырех американцев считают, что США должны продолжать поддерживать Украину, несмотря на угрозы России о ядерном оружии для защиты своей территории. Онлайн-опрос 1005 американцев показал, что 73 процента согласны с тем, что Соединенные Штаты должны продолжать поддерживать Украину, несмотря на предупреждения России о том, что она может использовать свой ядерный арсенал.  ",2022-10-08 00:00:00
Опубликованы кадры поздравления Путину на высотке Trump Tower в США,"Президента России Владимира Путина поздравили с 70-летним юбилеем на высотке Trump Tower в Майами. Кадры, на которых видна проекция поздравления, опубликованы в Telegram-канале «РИА Новости: США».«Никакого морального права даже заикаться о свободе демократии у этого Запада нет. C днем рождения, господин президент», — спроецировано на одной из башен.Ранее президент Белоруссии поздравил Путина с 70-летием, заявив, что дорожит доверительными отношениями со своим российской коллегой. Он подарил своему коллеге трактор BELARUS. О подарке на юбилей Лукашенко рассказал журналистам. «Такой, на котором я работаю, — BELARUS. Самый лучший. Ручной сборки», — заявил глава государства.Известно, что президент России, которому 7 октября исполнилось 70 лет, провел телефонные разговоры с лидерами Турции, Киргизии, Кубы, ЮАР, а также с бывшим президентом Казахстана Нурсултаном Назарбаевым, которые поздравили его с юбилеем.",2022-10-08 00:00:00
Обнаружена связь между недосыпом и диабетом,"Сомнолог София Черкасова сообщила о связи между недосыпом и диабетом второго типа в беседе с «Вечерней Москвой».Специалист отметила, что сам по себе поздний отход ко сну может и не вызывать никаких заболеваний, если человек постоянно спит в соответствующем его хронотипу режиме. По ее словам, также важно, чтобы человек спал достаточно по продолжительности.«Другое дело, что большая часть нашего общества — представители промежуточного хронотипа, которые откладывают отход ко сну в силу социальных обстоятельств. К примеру, они подолгу не спят ночью, выполняя работу, а после встают рано утром», — сказала она.Черкасова отметила, что подобная тенденция говорит о хроническом недосыпе, который может вызывать сахарный диабет второго типа.Также сомнолог предупредила, что недосып может вызвать артериальную гипертонию, депрессию, ускоренное старение, снижение уровня иммунитета и повышение предрасположенности к частым ОРВИ.Ранее кандидат медицинских наук, президент Российского общества сомнологов Михаил Полуэктов объяснил, что стресс, смена образа жизни и повышенная возбудимость нервной системы являются одними из самых распространенных причин нарушения сна. Специалист заверил, что при устранении причины стресса проблемы со сном в большинстве случаев исчезают.",2022-10-08 00:00:00
В КЖД рассказали о деталях пожара на Крымском мосту,"Возгорание топливной цистерны в хвосте грузового поезда произошло на Крымском мосту в субботу, 8 октября. О деталях рассказали ТАСС в пресс-службе Крымской железной дороги (КЖД).«В 06:05 аппаратура показала ложную занятость на ж/д путях на железнодорожной части транспортного перехода через Керченский пролив. Произошло возгорание топливной цистерны в хвосте грузового поезда», — заявили в организации.В КЖД добавили, что локомотив с частью вагонов выведен на станцию Керчь, ведутся аварийные работы, устанавливаются причины происшествия.Пожар на Крымском мосту произошел утром в субботу, 8 октября. Как рассказал советник главы Крыма Олег Крючков, на одном из участков сооружения, по предварительным данным, загорелась цистерна с топливом, судоходные арки не повреждены. Движение по Крымскому мосту приостановлено.",2022-10-08 00:00:00
Россиянам назвали способы использования валюты,"С конца февраля россияне столкнулись с трудностями в обращении валюты — сейчас они могут перевести ее в рубли, открыть валютный вклад или инвестировать в ценные бумаги или стартапы. Такие способы использования валюты назвал экономист Юрий Капышек в беседе с «Главным региональным».«Нужно перевести деньги в рубли и инвестировать или в ценные бумаги, или в стартапы. Тем более предложений от банков, которые работают в данном направлении и сами финансируют разработки, достаточно много», — заявил Каптышек.Вторым верным способом сохранить средства, по заверению эксперта, открыть валютный вклад в банке. «Процент маленький. Но хотя бы можно будет сохранить деньги», — отметил специалист.6 октября аналитик Исаков рекомендовал россиянам снижать долю валюты в сбережениях. Существуют и альтернативные валюты, которые могут стать одним из инструментов хранения сбережений. В первую очередь это, как считает Исаков, юань, который наиболее интересен по соображениям ликвидности.",2022-10-08 00:00:00
Ягудин одним словом описал дебют Щербаковой в роли ведущей «Ледникового периода»,"Олимпийский чемпион Алексей Ягудин высказался о первой съемке фигуристки Анны Щербаковой в роли ведущей телешоу «Ледниковый период». Его слова передает РИА Новости.«Гениально», — одним словом описал Ягудин дебют 18-летней спортсменки на телевидении. Он отметил высокий профессионализм фигуристки.5 октября стало известно, что Щербакова стала третьей ведущей нового сезона «Ледникового периода». 6 и 7 октября вместе с другими ведущими, Алексеем Ягудиным и олимпийской чемпионкой Алиной Загитовой, она принимала участие в съемках первых двух серий.Анна Щербакова — олимпийская чемпионка 2022 года. Помимо золота Игр, на счету фигуристки победы в личном и командном чемпионатах мира. Также она трижды выигрывала чемпионат России. Начало сезона-2022/2023 спортсменка пропускает, так как восстанавливается после операции на ноге.",2022-10-08 00:00:00
Диетолог назвала полезную замену сладостям,"Врач-диетолог, нутрициолог Ирина Писарева назвала полезную замену сладостям в беседе с RT.Специалист посоветовала употреблять фрукты «в умеренном количестве» до 17:00, примерно через два часа после еды, «чтобы переварилась основная пища».Также диетолог отметила, что полезной заменой могут быть сахарозаменители. По ее словам, лучше использовать натуральный эритрит, подсластитель стевия, а также сиропы топинамбура, агавы или цикория.Писарева добавила, что альтернативной заменой может быть мед, но только «если на него нет аллергии». Кроме того, Писарева порекомендовала заменить сладости различными сухофруктами, горьким шоколадом, домашними конфетами, которые сделаны из сухофруктов и горького шоколада, а также протеиновыми батончиками.Ранее врач-диетолог Руслан Алиев напомнил о доступных каждому способах ускорить обмен веществ и, как следствие, сбросить вес. По его словам, скорость метаболизма в организме можно контролировать при помощи спорта и еды.",2022-10-08 00:00:00
