title,text,date
"МВФ выделил 1,3 миллиарда долларов Украине","Исполнительный совет Международного валютного фонда (МВФ) в пятницу, 7 октября, одобрил предоставление Украине 1,3 миллиарда долларов в рамках инструмента МВФ для ускоренного финансирования. Об этом говорится в заявлении на сайте организации.Согласно документу, средства выделяются на «удовлетворение всех потребностей, связанных с финансированием платежного баланса» страны, в частности в продовольственной сфере. В МВФ считают, что эти деньги также «сыграют стимулирующую роль для дальнейшей финансовой поддержки со стороны кредиторов и доноров Украины».В фонде прогнозируют, что ВВП Украины сократится на 35 процентов в 2022 году.Глава МВФ Кристалина Георгиева в своем Twitter-аккаунте подтвердила выделение Украине 1,3 миллиарда долларов.В сентябре премьер-министр Украины Денис Шмыгаль сообщил, что Украина смогла договориться с Международным валютным фондом и в этом году получит 2,8 миллиарда долларов. Он также отметил, что еще 500 миллионов долларов на покупку газа на зимний период Украина получит от Великобритании.",2022-10-08 00:00:00
Земфира выпустила новый мини-альбом,"Певица Земфира выпустила новый мини-альбом «Земфира от Луки». Об этом артистка сообщила на сайте.Ранее Земфира анонсировала премьеру в своем Instagram (соцсеть запрещена в РФ; принадлежит корпорации Meta, которая признана в России экстремистской и запрещена), однако из-за отсутствия описания под фото поклонники находились в недоумении.В альбом вошли четыре песни — «II», «Время не щадит», «Апероль» и «Мой друг». Вечером 7 октября в своем Telegram-канале премьеру анонсировала и актриса Рената Литвинова, сопроводив пост совместной фотографией с певицей.В августе Земфира анонсировала гастрольный тур Borderline tour 2022. Концерты пройдут в 11 зарубежных городах с октября по ноябрь 2022 года — в Лимассоле, Тель-Авиве, Стамбуле, Вене, Праге, Оффенбахе, Гамбурге, Берлине, Париже, Гааге и Лондоне. Российские города в концертной программе не указаны.",2022-10-08 00:00:00
В ПДД появился новый сигнал светофора,"В правилах дорожного движения (ПДД) появилась секция под светофором в виде силуэта пешехода и стрелки «бело-лунного цвета». Она сообщает водителю, что на пути его поворота разрешено движение гражданам. Постановление опубликовано на сайте кабмина.«Информационная световая секция в виде силуэта пешехода и стрелки с мигающим сигналом бело-лунного цвета, расположенная под светофором, информирует водителя о том, что на пешеходном переходе, в направлении которого он поворачивает, включен сигнал светофора, разрешающий движение пешеходам», — отмечается в документе.Стрелка указывает на пешеходный переход, на котором включен сигнал светофора, разрешающий движение пешеходам. Уточняется, что подобный сигнал светофора в ПДД ранее не упоминался.7 октября правительство России утвердило изменения в правила дорожного движения (ПДД) — в них появились два дорожных знака и особая разметка. До утверждения изменений Минтранс и МВД России предлагали ввести в оборот знак для обозначения мест зарядки электромобилей и выделить дорожную разметку диагональных пешеходных переходов.",2022-10-08 00:00:00
Назван способ ускорить Windows 11,"Microsoft назвала способ ускорить работу Windows 11. Об этом сообщается на сайте компании.В заявлении корпорации говорится, что Microsoft продолжает изучать отзывы пользователей и реагировать на них. Потребителям, которые жалуются на низкую скорость работы ОС, инженеры рекомендовали отключить некоторые защитные функции операционной системы. К ним относятся функция проверки целостности памяти и платформа VMP.Специалисты отметили, что для отключения систем защиты нужно найти пункт «Изоляция ядра» через поиск и деактивировать данную настройку. Чтобы выключить VMP, необходимо найти через меню «Пуск» раздел «Включение или отключение возможностей Windows», затем в окне «Возможности Windows» найти пункт «Платформа виртуальной машины» и отключить настройку.«Геймеры, которым важна производительность, могут отключить эти функции во время игры и снова включить их по окончании игры», — отметили авторы. При этом после отключения ПК может быть уязвим для угроз.В конце сентября пользователи Windows 11 и компьютеров с видеокартами Nvidia пожаловались на снижение производительности в играх после выхода обновления 22H2. Специалисты рекомендовали пострадавшим геймерам удалить апдейт.",2022-10-08 00:00:00
Исмаилов победил нокаутировавшего Шлеменко бойца,"Российский боец смешанного стиля (MMA) Магомед Исмаилов победил серба Александра Илича. Об этом сообщает корреспондент «Ленты.ру».Поединок прошел по правилам бокса в рамках турнира PRAVDA. Бой продлился шесть раундов и завершился победой Исмаилова единогласным решением судей. Для 33-летнего Илича это был дебютный боксерский поединок. 36-летний Исмаилов уже однажды проводил бой по правилам бокса.26 августа Илич победил россиянина Александра Шлеменко. Бой, проходивший по правилам MMA, завершился нокаутом на 21 секунде. Всего на счету серба 14 побед при пяти поражениях.Исмаилов провел 21 бой в ММА. Он одержал 17 побед, трижды проиграл и один поединок свел вничью. Предыдущий бой он провел в октябре 2021 года. Тогда Исмаилов проиграл соотечественнику Владимиру Минееву нокаутом в третьем раунде.",2022-10-08 00:00:00
В Германии заявили о давлении Евросоюза на Шольца,"Канцлер ФРГ Олаф Шольц оказался под давлением других стран Евросоюза (ЕС) на прошедшем в Праге саммите Европейского политического сообщества из-за проводимой в Германии энергетической политики. Об этом заявил корреспондент ZDF Андреас Кюнаст.«Шольцу сегодня, вероятно, придется отвечать на вопросы о том, как обстоят дела с европейской солидарностью, о приверженности которой так много заявлялось. Действует ли она только в хорошие времена или в плохие все-таки тоже?», — задался вопросом журналист.Как объяснил Кюнаст, причиной критики стал немецкий «защитный зонтик» в 200 миллиардов евро, которые правительство Германии направило на решение энергетического кризиса. В Берлине, в частности, решили обеспечить себя энергией с избытком и покупать газ по любой цене. Другие страны Евросоюза, такие как Польша, Италия, Испания, Португалия и прибалтийские государства, опасаются, что ФРГ выйдет из нынешней тяжелой ситуации отчасти за их счет.В то же время, отмечает корреспондент, у Шольца нашлись сторонники в лице нидерландского премьера Марка Рютте и президента Франции Эммануэля Макрона. Кюнаст отметил, что Париж «наэкономил на совершенно аналогичный ""спасательный зонтик""».В результате Шольц оказался перед дилеммой, поскольку в Европе к нему предъявляют претензии за то, что от него требуют в Германии. При этом внутри страны не спадает недовольство граждан, требующих решения проблем с энегоресурсами.Ранее Олаф Шольц заявил, что Германия готова обеспечить свою безопасность в области энергетики вне зависимости от инцидента на «Северных потоках». Позже еврокомиссар по энергетике Кадри Симсон на заседании комитета Европарламента спрогнозировала, что европейские страны смогут обойтись без российского газа предстоящей зимой при мягкой погоде благодаря достаточному объему запасов.",2022-10-08 00:00:00
Стало известно о полете самолета США в месте повреждения «Северного-потока-2»,"Американский самолет-разведчик P-8A Poseidon пролетел над местом повреждения газопровода «Северный поток-2» через несколько часов после аварии. Об этом сообщает агентство Reuters со ссылкой на данные о перемещениях техники.«Разведывательный самолет ВМС США пролетел рядом с местом прорыва газопровода “Северный поток-2” в Балтийском море через несколько часов после появления первых повреждений», - пишет агентство.По информации Reuters, вылетевший из самолет США находился над Северным морем, когда был зафиксирован взрыв на трубопроводе. После этого разведчик направился к району трубопровода в Балтийском море, отмечает агентство. При этом Вашингтон назвал полет рутинным.Ранее США допустили участие в анализе подводных аудиозаписей в рамках расследования терактов, которые произошли на газопроводах «Северный поток» и «Северный поток-2». Обработка гидроакустических сигналов, предоставленных Швецией и Данией, может ускорить расследование, предоставив подробную картину происходящего во время взрывов. В материале подчеркивается, что Штаты обладают наиболее продвинутой системой обработки подводных звуков.Утечки на «Северных потоках» произошли в результате взрывов 26 сентября. Аварии были зафиксированы в территориальных водах Швеции и Дании. В Европе, США и России назвали случившееся диверсией.",2022-10-07 00:00:00
Мэйуэзер задумался о проведении двух боев с Макгрегором за рекордную сумму,"Американский боксер Флойд Мэйуэзер задумался о проведении поединков с ирландским бойцом смешанного стиля (MMA) Конором Макгрегором. Об этом сообщает The Sun.Команда Мэйуэзера провела переговоры с командой бывшего чемпиона Абсолютного бойцовского чемпионата (UFC) о контракте на два поединка. Отмечается, что первая схватка пройдет по правилам бокса, а вторая — по правилам смешанных единоборств.Ожидается, что бои пройдут в 2023 году в ОАЭ и Саудовской Аравии и их результаты войдут в статистику. Как сообщает источник, сумма контракта составит рекордную сумму в 1,5 миллиарда долларов.23 августа менеджер Макгрегора Тим Симпсон рассказал, что боец приостановил карьеру до 2023 года, потому что хочет сосредоточиться на актерской работе. «Все идет идеально. Конор еще на пути к большому возвращению в следующем году», — сообщил Симпсон.В июне 2021 года появилась информация, что Мэйуэзер готов дать реванш ирландцу за гонорар размером 300 миллионов долларов. Макгрегор и Мэйуэзер проводили бой по правилам бокса в 2017 году. Победу техническим нокаутом в 10-м раунде одержал американец.",2022-10-07 00:00:00
Российский город отказался от новогодней елки ради поддержки мобилизованных,"Власти Калининграда решили отказаться от покупки праздничной новогодней елки и оформления площади почти за 56 миллионов рублей. Эти средства будут направлены на закупку товаров для мобилизованных жителей региона. Об этом сообщается на официальном сайте администрации города.Отмечается также, что ранее с таким же предложением к муниципальным властям, в том числе и через социальные сети, обращались жители Калининграда.Ранее в Ленинградской области, Санкт-Петербурге и Нижнем Новгороде власти сообщили об отмене новогодних и рождественских мероприятий. Сэкономленные деньги, по словам местных администраций, будут направлены на поддержку участников специальной военной операции России на Украине (СВО), призванных в рамках частичной мобилизации и их семей. Обсуждение этого вопроса анонсировали и в Мосгордуме.Позже стало известно, что в администрации президента России идею отменить новогодние праздники сочли преждевременной и непроработанной.",2022-10-07 00:00:00
Американского журналиста затошнило от Зеленского,"Колумнист американского журнала Newsweek и ведущий Национал-консервативной конференции Джош Хаммер признался, что его тошнит от президента Украины Владимира Зеленского. Об этом он написал в своем Twitter-аккаунте.«Меня от Владимира Зеленского уже тошнит дальше некуда», — заявил журналист.Ранее официальный представитель МИД России Мария Захарова назвала президента Украины Владимира Зеленского «гороховым шутом».Зеленский заявлял, что НАТО следует не дожидаться возможного применения ядерного оружия Россией. Альянс, по его словам, должен нанести «превентивные удары». Позже он пояснил, что не имел в виду применение ядерного оружия по России, а говорил о новых санкциях Запада, которые должны предотвратить ядерную войну.",2022-10-07 00:00:00
Россиянин погиб на турецком курорте после падения с параплана,"Россиянин погиб в результате падения на скалистый участок с параплана в турецкой курортной Мугле. Об этом сообщает телеканал Habertürk.По информации телеканала, для того, чтобы совершить полет на параплане, россиянин Максим Кузин поднялся на 1200-метровую взлетно-посадочную полосу Бабадаг в районе Олюдениз. После взлета мужчина упал на скалы. Тело погибшего было доставлено вертолетом в государственную больницу Фетхие.«После получения уведомления в район были направлены поисково-спасательные группы жандармерии и Национальной медицинской спасательной службы. В ходе проверки было установлено, что Кузин скончался на месте», — отмечает Habertürk.Как сообщает СМИ, «из-за крутого и скалистого характера местности команды не смогли вынести тело Кузина, и после уведомления о ситуации к месту происшествия был направлен вертолет командования эскадрильи жандармерии Айдына».21 сентября в результате крушения пожарного вертолета на юго-западе Турции погибли два гражданина России. Уточняется, что остальные пилоты были госпитализированы в региональную больницу.",2022-10-07 00:00:00
МИД России указал на возросшую активность ядерных сил Запада,"Россия зафиксировала признаки, которые говорят о повышении активности ядерных сил западных государств, заявил заместитель руководителя департамента по нераспространению и контролю над вооружениями МИД России Константин Воронцов на заседании Первого комитета Генеральной Ассамблеи ООН. Его слова приводит РИА Новости.«Нами фиксировались признаки, свидетельствующие о повышении активности ядерных сил западных стран», — заявил он. Представитель российского ведомства также обратил внимание на «безответственную риторику» западных стран.По словам Воронцова, неделю назад представители Соединенных Штатов через СМИ угрожали Москве возможностью нанесения «обезглавливающего удара». Он заявил, что эти заявления делали американские военные. «Если в Вашингтоне считают подобную риторику ответственной и допустимой, то в этом зале подавляющее число стран с этим не согласится», — сказал он.Накануне президент Украины Владимир Зеленский заявил, что НАТО следует не дожидаться возможного применения ядерного оружия Россией. Альянс, по его словам, должен нанести «превентивные удары, чтобы они знали, что с ними будет, если они применят. А не наоборот — ждать ядерных ударов России, чтобы потом сказать: ""Ах, ты так, ну, вот держи от нас!""»",2022-10-07 00:00:00
