title,text,date
Лавров обвинил Запад в раскручивании ядерной риторики,"Запад раскручивает в общественном обсуждении вопрос применения ядерного оружия (ЯО), при этом пытаясь исказить действительное положение вещей и обвинить Россию в ядерной угрозе, заявил министр иностранных дел России Сергей Лавров в интервью «Аргументы и Факты».«В контексте кризиса вокруг Украины именно американцы и их союзники активно пытаются ввести в публичный оборот ядерную риторику», — сказал Лавров.Он также напомнил, как президент Украины Владимир Зеленский в ходе Мюнхенской конференции назвал ошибкой отказ Киева от ядерного оружия. Далее, по словам министра, к ядерной риторике прибегли и западные политики.«Вспомните, например, как легко в ходе предвыборной кампании нынешняя премьер-министр Великобритании пообещала, если понадобится, нажать на ""красную кнопку""», — высказался Лавров. Глава российского МИД продолжил: «Но западники все передергивают, пытаются представить дело так, будто ядерные угрозы озвучивает Россия и что она может применить ядерные вооружения на Украине».Ранее Зеленский заявил, что не имел в виду применение ядерного оружия по России, когда говорил о превентивных ударах. Политик отметил, что речь шла о новых санкциях западных стран, которые должны предотвратить ядерную войну.",2022-10-08 00:00:00
Аксенов назвал сроки запуска паромного сообщения через Керчь,"Паромное сообщение через Керчь в Крыму будет запущено сегодня. Об этом в субботу, 8 октября, заявил глава республики Сергей Аксенов в Telegram.По его словам, сегодня будет восстановлено пассажирское паромное сообщение. «И до конца дня, скорее всего, будет открыто уже автомобильное паромное сообщение», — сказал Аксенов.В свою очередь врио министра транспорта Крыма Николай Лукашенко заявил, что паромное сообщение позволяет запустить погода. Его слова передает РИА Новости. В данный момент ведется работа по открытию переправы в порт «Кавказ». «В настоящие время ведется пусконаладка и запуск двух паромов, и еще несколько паромов осуществляет движение в направление Республики Крым», — сказал он.Ранее Аксенов заявил, что восстановительные работы на Крымском мосту начнутся 8 октября. Он подчеркнул, что республика обеспечена всем необходимым, а продовольствия хватит более чем на два месяца.Утром 8 октября стало известно о ЧП на Крымском мосту через Керченский пролив. По данным Национального антитеррористического комитета, в результате подрыва грузового автомобиля частично обрушились два автомобильных пролета, а также загорелись семь топливных цистерн железнодорожного состава.",2022-10-08 00:00:00
Лавров обвинил США в нарушении международного права,"США растоптали международное право и заставляют другие страны жить по правилам, которые сами же и выдумывают, заявил глава МИД России Сергей Лавров в интервью газете «Аргументы и факты».«Американцы фактически растоптали международное право и существовавшие десятилетиями неписанные табу в дипломатической практике. Вопреки геополитическим реалиям, США пытаются ""подмять"" под себя остальных членов мирового сообщества, заставить всех жить по ""правилам"", которые сами же и выдумывают», — сказал министр.По словам главы внешнеполитического ведомства, русофобски настроенные элиты США мыслят иррационально и подталкивают Белый дом к открытой конфронтации с Россией. По мнению Лаврова, чтобы разорвать этот порочный круг, США следует отказаться от претензий на мировое господство.Ранее Лавров заявил, что США действовали как фюрер Третьего рейха Адольф Гитлер, подчинив себе страны Запада для того, чтобы сделать из Украины инструмент войны против России.",2022-10-08 00:00:00
Появились кадры досмотра взорвавшейся на Крымском мосту фуры,"В сети появились кадры досмотра фуры на посту ГИБДД, которая, предположительно, взорвалась на Крымском мосту. Видеозапись публикует Telegram-канал Mash.На кадрах видно, как сотрудник ГИБДД досматривает фуру. Водитель транспортного средства открывает прицеп для сотрудника ГИБДД. Инспектор не видит ничего подозрительного внутри, после чего грузовик покидает КПП.ЧП на Крымском мосту произошло рано утром в субботу, 8 октября. Национальный антитеррористический комитет (НАК) назвал случившееся подрывом, подчеркнув, что на мосту взорвался грузовой автомобиль. В результате частично обрушились два автомобильных пролета моста, а также загорелись семь топливных цистерн железнодорожного состава.Глава Крыма Аксенов заявил, что восстановительные работы на мосту начнутся в субботу, 8 октября, сразу после окончания действий следственных органов. ",2022-10-08 00:00:00
Ева Мендес отреагировала на слухи о завершении карьеры,"Американская актриса Ева Мендес опровергла слухи о завершении карьеры. Об этом пишет PageSix.Артистка опубликовала в своем Instagram (соцсеть запрещена в РФ; принадлежит корпорации Meta, которая признана в России экстремистской и запрещена) видеоролик c заголовками из прессы, в которых утверждается о ее уходе из кино. Мендес прокомментировала публикацию словами о том, что решила отдать приоритет своей семье.«Я хотела быть дома со своими детьми», — написала она. «К счастью, в других сферах деятельности мне это позволили сделать, чего не скажешь об актерском искусстве».Вместе с супругом Райаном Гослингом Мендес воспитывает двух дочерей — 8-летнюю Эсмеральду и 6-летнюю Амаду. Актриса известна по фильмам «Правила съема: Метод Хитча», «Место под соснами», «Вне времени», «Прошлой ночью в Нью-Йорке» и другим проектам.Ранее сообщалось о том, что режиссер Вуди Аллен не станет завершать кинематографическую карьеру.",2022-10-08 00:00:00
Паша Техник вышел из комы,"Российский рэпер Паша Техник вышел из комы и сейчас находится в сознании. Об этом сообщает Telegram-канал «112».При этом отмечается, что его состояние все еще оценивается как тяжелое. Паша Техник останется в отделении реанимации и интенсивной терапии, рассказали врачи.О госпитализации Паши Техника стало известно 7 октября. У исполнителя произошел припадок из-за передозировки седативными препаратами. Момент, когда его без сознания выносили из дома до машины скорой помощи, попал на видео. Позднее в больнице рэпера подключили к ИВЛ. Медики также ввели его в медикаментозную кому, чтобы стабилизировать состояние.Уже позже появились данные, что российскому рэперу диагностировали перелом носа. Помимо этого, медики выявили пневмофиброз и пневмонию. Психиатр артиста также назвал возможную причину припадка рэпера.",2022-10-08 00:00:00
В России рассказали о применении самодельных дронов в Лисичанске со стороны ВСУ,"Военные Вооруженных сил Украины (ВСУ) используют самодельные ударные дроны на Лисичанском направлении в Донбассе, рассказал боец спецподразделения «Ахмат» с позывным «Разведчик» в разговоре с РИА Новости.«Артиллерия у них работает в нашу сторону, и дроны самодельные снаряды кидают на нас. Используют также танки и минометы», — отметил он. Российский боец уточнил, что речь идет о самодельных ударных беспилотниках с гранатометными выстрелами ВОГ-17 на борту.Ранее сообщалось, что ВСУ нанесли удар из американской реактивной системы залпового огня HIMARS по дорожной развязке Рубежное-Кременная. Удар нанесли 6 октября, среди военнослужащих союзных войск есть погибшие и раненые.",2022-10-08 00:00:00
В МИД России высказались о непризнавших референдумы странах,"Москва готова не торопить зарубежных партнеров с вопросом признания результатов референдумов в ДНР, ЛНР, Запорожской и Херсонской областях. Об этом сообщил глава МИД Сергей Лавров, разъясняя позицию российской стороны в интервью газете «Аргументы и факты».Он отметил, что с момента проведения референдумов прошло совсем немного времени. По мнению Лаврова, западные партнеры еще должны осознать новые геополитические реалии.«Никого торопить мы не будем», — заверил глава МИД России.В то же время Лавров указал, что для Москвы приоритетна реализация «результатов свободного волеизъявления жителей освобожденных территорий в соответствии с основополагающими нормами международного права, прежде всего правом народов на самоопределение».«Мы знаем, каким жесточайшим притеснениям киевский режим подвергал русское и русскоязычное население после переворота 2014 года Очевидно, что власти в Киеве не представляют жителей Донбасса, Запорожской и Херсонской области», — пояснил он.Ранее  Лавров счел непринципиальным признание референдумов странами Запада.Референдумы по вопросу о вхождении в состав России ДНР и ЛНР, а также в Херсонской и Запорожской областях прошли с 23 по 27 сентября. Подавляющее большинство граждан поддержали это решение.",2022-10-08 00:00:00
Аксенов назвал дату начала восстановительных работ на Крымском мосту,"Восстановительные работы на Крымском мосту после ЧП начнутся после окончания действий следственных органов — в субботу, 8 октября. Об этом заявил глава Крыма Сергей Аксенов в Telegram-канале.«Будут выработаны меры по устранению повреждений и восстановлению разрушенного. Работы начнутся сразу после окончания действий следственных органов», — написал глава республики.Он заверил жителей Крыма, что республика обеспечена всем необходимым — запасов топлива хватит более чем на месяц, продовольствия достаточно более чем на два месяца.Аксенов попросил жителей набраться терпения, сохранять выдержку и спокойствие. Он подчеркнул, что после ЧП на мосту ситуация находится под контролем.ЧП на Крымском мосту произошло рано утром в субботу, 8 октября. Национальный антитеррористический комитет (НАК) назвал случившееся подрывом, подчеркнув, что на мосту взорвался грузовой автомобиль. В результате частично обрушились два автомобильных пролета моста, а также загорелись семь топливных цистерн железнодорожного состава.После случившегося президент России Владимир Путин поручил сформировать комиссию для выяснения причин произошедшего и скорейшей ликвидации последствий. В нее войдут  главы Краснодарского края и Крыма, а также представители Росгвардии, ФСБ и МВД.",2022-10-08 00:00:00
Стало известно о возможном начале поставок в Херсон и Крым через Донбасс,"Стало известно о новой возможной схеме поставок товаров в Херсонскую область и Крым после обрушения Крымского моста. Как заявил ТАСС замглавы военно-гражданской администрации (ВГА) Херсонской области Кирилл Стремоусов, эти территории могут снабжаться через Донбасс.«Все возможно. Будет сделано все, что необходимо, чтобы создать условия, в которых все будет продолжаться», — заявил Стремоусов в ответ на вопрос издания, возможна ли такая переориентация логистики.Ранее советник главы Крыма по информационной политике Олег Крючков заявил, что из Крыма в регионы России налажен сухопутный коридор через новые территории — Херсонскую, Запорожскую области, а также ДНР. Он также отметил, что Крым обеспечен запасом продовольствия и энергоносителей. Помимо этого, сейчас заполнены стратегические нефтехранилища.Утром 8 октября на Крымском мосту произошел пожар. Как уточнили в пресс-службе Крымской железной дороги (КЖД), пожар стал следствием возгорания топливной цистерны в хвосте грузового поезда. По данным Национального антитеррористического комитета (НАК), во время движения по Крымскому мосту произошел подрыв автомобиля.В результате произошло обрушение двух автомобильных пролетов моста и возгорание семи топливных цистерн железнодорожного состава. Движение по мосту остановлено, пострадавших, по предварительным данным, нет. В Крыму заявили, что к запуску уже готова паромная переправа.",2022-10-08 00:00:00
Оценены последствия подрыва Крымского моста,"Если в ходе расследования будет установлена причастность украинских спецслужб к подрыву Крымского моста, то последуют ответные меры. Так последствия ЧП оценил генеральный директор Российского совета по международным делам (РСМД) Андрей Кортунов в беседе с «Лентой.ру».Утром 8 октября стало известно, что на Крымском мосту произошел подрыв грузового автомобиля. Происшествие стало причиной частичного обрушения двух автомобильных пролетов моста и возгорания семи топливных цистерн железнодорожного состава.«Надо установить, кто может быть ответственным. Если будет доказано, что это украинские спецслужбы, то тогда возможны ответные меры военного характера для того, чтобы продемонстрировать неприемлемость подобных действий», — считает Кортунов.Политолог отметил, что сейчас необходимо создать условия для крымчан и туристов, чтобы у них была возможность приехать и выехать с полуострова.«Конечно, будут происходить восстановительные работы. Одновременно будут задействованы альтернативные коммуникационные линии. В частности, будут задействованные паромные переправы. Большая нагрузка сейчас выпадет именно на морской транспорт. Сейчас надо оценить масштабы ущерба для того, чтобы восстановить мост», — заключил он.Движение по мосту на момент выхода материала остановлено. Пострадавших, по предварительным данным, нет. Подготовка к восстановительным работам уже началась, Минтранс запустил новые логистические маршруты, также заработала Керченская районная переправа.",2022-10-08 00:00:00
На Украине подрыв Крымского моста назвали результатом спецоперации СБУ,"Подрыв Крымского моста через Керченский пролив произошел в результате спецоперации Службы безопасности Украины (СБУ). Об этом сообщает «Интерфакс-Украина» со ссылкой на источник в силовых структурах.Официально эту информацию СБУ пока не комментирует.Ранее взрыв и пожар на Крымском мосту прокомментировал советник главы офиса президента Украины Михаил Подоляк. «Все украденное должно быть возвращено Украине, все оккупированное Россией должно быть уничтожено», — написал он в Twitter.В свою очередь, депутат Госдумы Олег Морозов назвал ЧП с Крымским мостом объявлением войны без правил. По его словам, сейчас «ведется неприкрытая террористическая война» и Россия должна ответить на инцидент.О пожаре на мосту через Керченский пролив в Крыму стало известно утром 8 октября. По данным Национального антитеррористического комитета, в результате подрыва грузовой машины загорелись семь топливных цистерн железнодорожного состава, а также частично обрушились два автомобильных пролета.",2022-10-08 00:00:00
